{
  "schema": "votc-ck3-mod-inputs/v1",
  "source": {
    "upstreamRepository": "Voices-of-the-Court/votc_mod",
    "upstreamRevision": "0cf4845a69f9e8633333ca04e558afe8216490f2",
    "upstreamBaseVersion": "2.0.4",
    "maintainedModBase": "2.0.5",
    "bridgeRevision": 1
  },
  "gameCompatibility": {
    "target": "CK3 1.20.*",
    "verifiedVersions": []
  },
  "fileCount": 97,
  "totalBytes": 12996960,
  "treeHashRule": "SHA-256 of UTF-8 relativePath + NUL + decimal size + NUL + lowercase file SHA-256 + LF, sorted by relativePath.localeCompare(en).",
  "sourceRevision": "866f32ba82bb6d9c7d0dec4aee8568450efbfe60e7f4e151c1c13d7c0c4db8eb",
  "modPayloadTreeSha256": "866f32ba82bb6d9c7d0dec4aee8568450efbfe60e7f4e151c1c13d7c0c4db8eb",
  "artifactSha256": "866f32ba82bb6d9c7d0dec4aee8568450efbfe60e7f4e151c1c13d7c0c4db8eb",
  "artifactHashScope": "mod-payload-tree; no archive or ZIP is implied",
  "files": [
    {
      "relativePath": "common/activities/activity_types/votc_council_gathering.txt",
      "size": 19646,
      "sha256": "61c145e6bf469cce568d1b0af411dad5f2abaffc5f0120953c510ba9ee108328"
    },
    {
      "relativePath": "common/activities/intents/votc_activity_intents.txt",
      "size": 271,
      "sha256": "214248e795c04468e02ebb19e6b0f9c041241ebf35a243f20a1293cda46d8326"
    },
    {
      "relativePath": "common/character_interactions/invite_to_talk_interactions.txt",
      "size": 4616,
      "sha256": "402b54909f32a5ee2c98ee9760d813ebf5bd51bf75e7c25a7e5106518a48b2fd"
    },
    {
      "relativePath": "common/character_interactions/mcc_interactions.txt",
      "size": 883,
      "sha256": "ece89b1240dd593b242c0cb4dc04ec00fc71072bfbf4624c9cb17947fdaf6970"
    },
    {
      "relativePath": "common/character_interactions/message_interactions.txt",
      "size": 2516,
      "sha256": "92a323ebff359d606cd4f74aedcfdcc4b6b5a2ae5b7298674edf16e94a0733e0"
    },
    {
      "relativePath": "common/character_interactions/talk_interactions.txt",
      "size": 4430,
      "sha256": "9cad939f65abf9ab85af01de902ccde1b81edfcde2ffadaa7cb27176e6cb8ea2"
    },
    {
      "relativePath": "common/decisions/votc_decisions.txt",
      "size": 689,
      "sha256": "8f243aa74d7f6ebeae371275352b117be513bc9adf0cd8e05d321fdeb7450726"
    },
    {
      "relativePath": "common/defines/message_length.txt",
      "size": 45,
      "sha256": "9885481f8a99dff8963a5c04c4947da70a6adaa76781da1888f4ca2d253087b1"
    },
    {
      "relativePath": "common/event_themes/clipboard_transfer_event_theme.txt",
      "size": 389,
      "sha256": "d1f5374d118253ec2774654041b273597252ecdbd488a6d09258c0aa4a091fe9"
    },
    {
      "relativePath": "common/messages/votc_message.txt",
      "size": 324,
      "sha256": "c4d42c218c36e51a1bf878d8381e47374a8583d3a4648425e6dd6bf5cff4f430"
    },
    {
      "relativePath": "common/on_action/votc_load_boundary.txt",
      "size": 1372,
      "sha256": "1f1803e94996013352c4a213b06aa76fde9140407062d48408eb61b2cde5ca94"
    },
    {
      "relativePath": "common/opinion_modifiers/conversation_opinion.txt",
      "size": 107,
      "sha256": "ed88f0085c937a6b43d435a0305282dcd5425be6656acb1d7d0148f469a45daa"
    },
    {
      "relativePath": "common/script_values/letter_delay.txt",
      "size": 2225,
      "sha256": "c12bbd7a3d85b8f257ef980439106e80ef696849d9542136411ab104843d9aab"
    },
    {
      "relativePath": "common/script_values/levies_total.txt",
      "size": 19406,
      "sha256": "76c7d8a8306cac428124626269bcea2d4b9431ad4ac23216a0d7dd8a3eb38452"
    },
    {
      "relativePath": "common/script_values/weight_memory_relevance.txt",
      "size": 461,
      "sha256": "27613f10f2bdc6e952a858745470cd3954e6f25ef9ca14ab63a601f4c3a1912e"
    },
    {
      "relativePath": "common/scripted_effects/interaction_effects.txt",
      "size": 515,
      "sha256": "188256c9443acd505f2727c58c19885f221b48fd43ec416e7719299071b98d4d"
    },
    {
      "relativePath": "common/scripted_effects/log_character_v2_effect.txt",
      "size": 25767,
      "sha256": "235fd463ff099cf63577a73cb2136caaa41625b2a9482abc431d6edc65bc35d4"
    },
    {
      "relativePath": "common/scripted_effects/log_gamedata_v3_effect.txt",
      "size": 4087,
      "sha256": "e9d1cb98f23568cee144b3850fa8a46ab755eef8cfb833547c1d2e305c89a10b"
    },
    {
      "relativePath": "common/scripted_effects/log_gamedata_v3l_effect.txt",
      "size": 3586,
      "sha256": "ca9d045bd731e41d1adc01d7d5f83f5cd6f8a802c7ba6419cd168005f1cb6aef"
    },
    {
      "relativePath": "common/scripted_effects/log_gamedata_v3s_effect.txt",
      "size": 3818,
      "sha256": "b19b273c2a92450462fa4155f9d81385d54346af3a3a6efcc97645c394ec0db3"
    },
    {
      "relativePath": "common/scripted_effects/votc_campaign_identity_effect.txt",
      "size": 11077,
      "sha256": "e301c82a9314a5ffb323f9bc4f78e5a1a6f2e35eff3c2660b4aa616e1b058cdd"
    },
    {
      "relativePath": "common/scripted_guis/mcc_selection.txt",
      "size": 1987,
      "sha256": "e73291780338029481c81e61e005917652740b1bcd849c860d170670cb20a1a1"
    },
    {
      "relativePath": "common/scripted_guis/votc_runtime_clock.txt",
      "size": 260,
      "sha256": "fde0259f116a66e602b0fd7e7b14e617ec8680a35024b582f1f696e8ba1be004"
    },
    {
      "relativePath": "common/scripted_guis/votc_select_talk_scene.txt",
      "size": 172,
      "sha256": "32aad2293e123f700481fa4faf3f8ac7cd9382ca2de294eaac8f9a14c9274da3"
    },
    {
      "relativePath": "common/scripted_modifiers/votc_council_gathering_modifiers.txt",
      "size": 655,
      "sha256": "c9a8245ac6e9a2105b3f0e7b4b2b5e77a206ff9346991927d538e7c568a59919"
    },
    {
      "relativePath": "common/scripted_triggers/scene_triggers.txt",
      "size": 2669,
      "sha256": "0818377178942868bb93ce871f2b7b4f521446da342d7ae54bb0a4824e2dab48"
    },
    {
      "relativePath": "descriptor.mod",
      "size": 122,
      "sha256": "c77060613e6cf45e9a2aa6b2215f4d689104a90d25791aa421794199a8fefa80"
    },
    {
      "relativePath": "events/mcc_events_v2.txt",
      "size": 15784,
      "sha256": "4e5c2a4b20e7cc51474d64e2ee2735d729a0d69c0126b5290f01f6f67fe9c56d"
    },
    {
      "relativePath": "events/message_events.txt",
      "size": 6026,
      "sha256": "b55f3fffde18cd938ff0974f07ae4e5a7130197d8be69c3797e6aa6447e1827f"
    },
    {
      "relativePath": "events/silence_ck3_errors_events.txt",
      "size": 25435,
      "sha256": "d4dc446a9435ea93bf50fbdea66129cf1059ef1046d03303c595d450ab1e618f"
    },
    {
      "relativePath": "gfx/0.dds",
      "size": 144,
      "sha256": "3b25cb963c8c03007ec9385b518f6c0292e1c9da405dca5d1dd9d6e6fc51b1b9"
    },
    {
      "relativePath": "gfx/interface/icons/activities/_activity_votc_council_gathering_header.dds",
      "size": 36656,
      "sha256": "53243ee750cb1255b26c869220a4ab445460fba74a8562560879a925e8509087"
    },
    {
      "relativePath": "gfx/interface/icons/activities/activity_votc_council_gathering_header.dds",
      "size": 36656,
      "sha256": "1d43731366438d2095f8a3ae4760bd00eec86ca0ccfe23fbdc51069cc2d5071e"
    },
    {
      "relativePath": "gfx/interface/icons/activities/activity_votc_council_gathering.dds",
      "size": 8768,
      "sha256": "976e621d052a75b8990441816ecca70fb6be5b2c08b052a0cc172cde713a4214"
    },
    {
      "relativePath": "gfx/interface/icons/activity_option_categories/votc_council_gathering_amenities_amount.dds",
      "size": 15584,
      "sha256": "184405e9b6cc8692d8d230635ee84218bc5a709fe46b0bf19bfe4465fbe0c686"
    },
    {
      "relativePath": "gfx/interface/icons/activity_phases/votc_council_gathering_council_phase.dds",
      "size": 78528,
      "sha256": "e7cce8e7a3a20e2f6a46e648e389c119c96e100ecd6427a7c4509ddb1f45f76a"
    },
    {
      "relativePath": "gfx/interface/illustrations/activity_backgrounds/activity_votc_council_gathering.dds",
      "size": 1801648,
      "sha256": "f693f63b341535fc6bd32bf6d284eacd68162cd4e692dda77a040eea658ee5f1"
    },
    {
      "relativePath": "gfx/interface/illustrations/activity_header_backgrounds/activity_votc_council_gathering.dds",
      "size": 1801648,
      "sha256": "f693f63b341535fc6bd32bf6d284eacd68162cd4e692dda77a040eea658ee5f1"
    },
    {
      "relativePath": "gfx/interface/illustrations/scripted_illustrations/scene_background_selector.txt",
      "size": 124103,
      "sha256": "3393d859961125f9fee1c73dbe1ebba224932ef54444629df8ec7223aebf8b6a"
    },
    {
      "relativePath": "gfx/interface/illustrations/scripted_illustrations/scene_background.txt",
      "size": 292561,
      "sha256": "5b255c1d914e342852d9149facfadbe514c2cbdb449d3996b8b440c3153fa3b1"
    },
    {
      "relativePath": "gfx/interface/tavern_gfx/mask_off.dds",
      "size": 8294528,
      "sha256": "2649283a16c47f2561bc94198237409c49c6907688558fe8154602f514ed3722"
    },
    {
      "relativePath": "gfx/portraits/cameras/conversation_camera.txt",
      "size": 708,
      "sha256": "7689844b9eaaf936620ef332049c036cc6e9183d752ee64f71f8e815c8c2d5d7"
    },
    {
      "relativePath": "gfx/portraits/portrait_animations/conversation_animations_v2.txt",
      "size": 20550,
      "sha256": "5f4fb9db95ec3d522c7496f129ea122d171c5488c3dac2ff4d1d78482fd940c3"
    },
    {
      "relativePath": "gfx/portraits/portrait_animations/conversation_animations.txt",
      "size": 3602,
      "sha256": "fe05c3c27c311579b84aed963d9c977437cd4b5c6678eefdf9c043f83d391085"
    },
    {
      "relativePath": "gui/custom_gui/letters_runner.gui",
      "size": 246,
      "sha256": "2181018c19f3884dc13f49252ef0caa9ffd71c9951b4192f83cea654ea1a4e1a"
    },
    {
      "relativePath": "gui/custom_gui/mcc_characters_window.gui",
      "size": 46330,
      "sha256": "95dc4c5584a93529fcd18d4977d403d529b1d74293c9b525bd3c6ca801936c40"
    },
    {
      "relativePath": "gui/custom_gui/talk_window_v2.gui",
      "size": 2436,
      "sha256": "f335c8628f4fb50178017978c4988709d5ce35f29f631c5f840b17c4af93d000"
    },
    {